{
  "protocolVersion": "0.1",
  "serviceId": "edge.example.ai",
  "displayName": "Example TOS AI Edge Terminal",
  "controller": "tos:test:replace-with-controller-address",
  "network": "testnet",
  "revision": "bootstrap-1",
  "expiresAt": "2030-01-01T00:00:00Z",
  "profiles": [
    {
      "id": "tos.ai.inference",
      "version": "0.1",
      "mediaType": "application/vnd.tos.ai-inference+json",
      "url": "https://edge.example/.well-known/tos-inference.json",
      "digest": "sha256:aaaaaaaaaaaaaaaaaaaaaaaaaaaaaaaaaaaaaaaaaaaaaaaaaaaaaaaaaaaaaaaa"
    }
  ],
  "ardIdentifier": "urn:air:edge.example:tos:ai-terminal",
  "tosName": "example.tos"
}
